{
  "$schema": "./schema.json",
  "formato": 1,
  "ibge": "4218806",
  "municipio": "Turvo",
  "uf": "SC",
  "fonte_id": "turvo",
  "fonte": {
    "url": "https://diariomunicipal.sc.gov.br/atos/5204854",
    "licenca": "Atos oficiais de Turvo: domínio público (Lei 9.610/1998 art. 8º IV). Geometria: OpenStreetMap (ODbL 1.0, © colaboradores do OSM) e limites municipais do IBGE.",
    "notas": "Dec. 68/2023 relido no DOM/SC; só a TVO-352 (art. 1º, II) ativa. A TVO-150 (art. 1º, I) fica desativada: \"SC-285\" inexistente e renumerações das Leis 2.547/2023, 2.549/2023 e 2.700/2026."
  },
  "verificado_em": "2026-10-18",
  "vuc": null,
  "vuc_nota": "Turvo não define VUC nos atos lidos: o VUC é tratado como caminhão.",
  "regras": [
    {
      "id": "turvo_dec68_2023_tvo352",
      "tipo": "via",
      "regime": "Rodovias municipais TVO: PBT > 15 t",
      "nome": "Turvo: Dec. 68/2023 art. 1, II, proibido tráfego de caminhões e veículos pesados com PBT > 15 t na TVO-352 (divisa Timbé do Sul, Rio do Salto, até a Rua São João Batista, Morro Chato)",
      "status": "ativa",
      "confianca": "media",
      "janelas": [
        {
          "days": [
            1,
            2,
            3,
            4,
            5,
            6,
            7
          ],
          "from": "00:00",
          "to": "24:00"
        }
      ],
      "alvo": {
        "caminhao": true,
        "qualquer": [
          {
            "campo": "pbt_t",
            "acima": 15
          }
        ]
      },
      "excecoes": [
        "Transporte coletivo regular",
        "Carga e descarga de bens e valores bancários",
        "Coleta de lixo e serviços emergenciais de saúde",
        "Caminhões e veículos de carga para escoamento da produção agrícola, pecuária ou agroindustrial de imóveis situados nas rodovias do art. 1º (art. 2º, IV)",
        "Manutenção de emergência em redes e guincho"
      ],
      "base_legal": [
        {
          "ato": "Decreto nº 68, de 24/08/2023 (publicado no DOM/SC em 16/10/2023)",
          "artigo": "art. 1º, I e II (rodovias), art. 2º (exceções, inclusive escoamento de produção agrícola/pecuária/agroindustrial das propriedades nessas rodovias), art. 4º (balanças privadas)",
          "url": "https://diariomunicipal.sc.gov.br/atos/5204854"
        }
      ],
      "vigencia_inicio": "2023-08-24",
      "trechos": [
        {
          "inciso": "art. 1º, II",
          "via": [
            "Rodovia Municipal TVO-352"
          ],
          "descricao": "da divisa Turvo/Timbé do Sul, em Rio do Salto, até a Rua São João Batista, no Distrito de Morro Chato",
          "aproximado": true
        }
      ],
      "nota": "Atenção à renumeração: as Leis 2.547/2023 (TVO-150 -> TVO-374, de São José/TVO-250 até Morro Azul/TVO-153) e 2.549/2023 (TVO-150 -> TVO-375, da Vila Progresso/BR-285 até o limite com Timbé do Sul), de 19/12/2023, renumeraram trechos da TVO-150 sem alterar o decreto (que ainda cita TVO-150). Conferir a numeração atual ao montar a geometria. Geometria: ways do OSM com ref=TVO-352 (3 sem name e 3 como \"Rua São João Batista\"); a TVO-352 começa no limite com Timbé do Sul (TBS-010 do outro lado) e termina na Rua São João Batista.",
      "geometria": [
        {
          "arquivo": "municipios/geo/4218806_vias.geojson",
          "construir": "manual",
          "como_gerar": "Ways do OSM com ref=TVO-352 (da divisa Turvo/Timbé do Sul, onde começa a TVO-352, até o fim da Rua São João Batista em Morro Chato), extraídos do PBF; 6 ways encadeados, ~4,7 km."
        }
      ],
      "feriados": "aplica",
      "fonte_geometria": "Eixos do OSM (ODbL) com ref=TVO-352, da divisa com Timbé do Sul à Rua São João Batista (Morro Chato)"
    },
    {
      "id": "turvo_dec68_2023_tvo150",
      "tipo": "via",
      "regime": "Rodovias municipais TVO: PBT > 15 t",
      "nome": "Turvo: Dec. 68/2023 art. 1, I, TVO-150 da Vila Progresso ate a 'SC-285' (PBT > 15 t)",
      "status": "desativada",
      "confianca": "baixa",
      "janelas": [
        {
          "days": [
            1,
            2,
            3,
            4,
            5,
            6,
            7
          ],
          "from": "00:00",
          "to": "24:00"
        }
      ],
      "alvo": {
        "caminhao": true,
        "qualquer": [
          {
            "campo": "pbt_t",
            "acima": 15
          }
        ]
      },
      "excecoes": [
        "Transporte coletivo regular",
        "Carga e descarga de bens e valores bancários",
        "Coleta de lixo e serviços emergenciais de saúde",
        "Caminhões e veículos de carga para escoamento da produção agrícola, pecuária ou agroindustrial de imóveis situados nas rodovias do art. 1º (art. 2º, IV)",
        "Manutenção de emergência em redes e guincho"
      ],
      "base_legal": [
        {
          "ato": "Decreto nº 68, de 24/08/2023 (publicado no DOM/SC em 16/10/2023)",
          "artigo": "art. 1º, I e II (rodovias), art. 2º (exceções, inclusive escoamento de produção agrícola/pecuária/agroindustrial das propriedades nessas rodovias), art. 4º (balanças privadas)",
          "url": "https://diariomunicipal.sc.gov.br/atos/5204854"
        }
      ],
      "vigencia_inicio": "2023-08-24",
      "nota": "Atenção à renumeração: as Leis 2.547/2023 (TVO-150 -> TVO-374, de São José/TVO-250 até Morro Azul/TVO-153) e 2.549/2023 (TVO-150 -> TVO-375, da Vila Progresso/BR-285 até o limite com Timbé do Sul), de 19/12/2023, renumeraram trechos da TVO-150 sem alterar o decreto (que ainda cita TVO-150). Conferir a numeração atual ao montar a geometria.",
      "geometria": [
        {
          "geojson": {
            "type": "FeatureCollection",
            "features": []
          }
        }
      ],
      "status_motivo": "Verificado 18/10/2026: o decreto fala em 'TVO 150 - Vila Progresso ate a SC-285' (nao existe SC-285; a Lei 2.549/2023 cita BR-285) e a numeracao mudou (Leis 2.547 e 2.549/2023 renumeraram trechos para TVO-374/TVO-375; Lei 2.700/2026 define a TVO-150 como TVO-364 ate TVO-153 no Morro Azul, 8,5 km). O trecho do decreto nao e identificavel com seguranca.",
      "feriados": "aplica"
    }
  ]
}
